-- ProgreSQL: spanning (GLOBAL) indexes over table inheritance (INHERITS).
--
-- "Inherit at the top, partition/bucket the leaves": one spanning index on an
-- ordinary inheritance root enforces uniqueness across every storage-bearing
-- leaf at any depth -- across time buckets AND across typed children -- on
-- build, INSERT, UPDATE, and through the dynamic add/remove of leaves.
--
-- The discriminator (partseq) resolves to any leaf relation, so the only thing
-- that had to generalize from declarative partitioning was leaf enumeration and
-- leaf->root resolution (find_all_inheritors / progresql_spanning_ancestors).
-- The cross-leaf uniqueness invariant (GROUP BY ... HAVING count(*) > 1 == 0
-- rows, queried from the inheritance root) is the oracle here; amcheck's
-- structural check is exercised by the soak harness, not this suite.
-- Section 1: the shape -- inheritance root, typed children, time-bucket leaves.
CREATE TABLE ent (id int NOT NULL, ts date NOT NULL, kind text);
CREATE TABLE msg (body text) INHERITS (ent);
CREATE TABLE msg_2026_01 (CHECK (ts >= '2026-01-01' AND ts < '2026-02-01')) INHERITS (msg);
CREATE TABLE msg_2026_02 (CHECK (ts >= '2026-02-01' AND ts < '2026-03-01')) INHERITS (msg);
CREATE TABLE fct (claim text) INHERITS (ent);
CREATE TABLE fct_2026_01 (CHECK (ts >= '2026-01-01' AND ts < '2026-02-01')) INHERITS (fct);
-- Section 2: build-time enforcement -- a pre-existing cross-leaf duplicate must
-- make the GLOBAL index build fail (backfill runs UNIQUE_CHECK over all leaves).
INSERT INTO msg_2026_01(id, ts, kind, body) VALUES (1, '2026-01-10', 'm', 'a');
INSERT INTO fct_2026_01(id, ts, kind, claim) VALUES (1, '2026-01-12', 'f', 'dup');  -- same id, different leaf+type
CREATE UNIQUE INDEX ent_id_g ON ent (id) GLOBAL;   -- ERROR: build sees the cross-leaf dup
ERROR:  duplicate key value violates unique constraint "ent_id_g"
DETAIL:  Key (id)=(1) already exists.
DELETE FROM fct_2026_01 WHERE claim = 'dup';
-- clean build now succeeds and spans the whole tree
INSERT INTO msg_2026_02(id, ts, kind, body) VALUES (2, '2026-02-10', 'm', 'b');
INSERT INTO fct_2026_01(id, ts, kind, claim) VALUES (3, '2026-01-12', 'f', 'c');
CREATE UNIQUE INDEX ent_id_g ON ent (id) GLOBAL;
SELECT count(*) AS rows_via_root FROM ent;
 rows_via_root 
---------------
             3
(1 row)

-- Section 3: live enforcement -- INSERT and UPDATE, cross-time and cross-type.
INSERT INTO msg_2026_02(id, ts, kind, body) VALUES (1, '2026-02-15', 'm', 'x');  -- ERROR: cross-time dup
ERROR:  duplicate key value violates unique constraint "ent_id_g"
DETAIL:  Key (id)=(1) already exists.
INSERT INTO msg_2026_01(id, ts, kind, body) VALUES (3, '2026-01-20', 'm', 'x');  -- ERROR: cross-type dup (3 is a fct)
ERROR:  duplicate key value violates unique constraint "ent_id_g"
DETAIL:  Key (id)=(3) already exists.
INSERT INTO msg_2026_02(id, ts, kind, body) VALUES (9, '2026-02-16', 'm', 'ok'); -- ok: new id
UPDATE fct_2026_01 SET id = 2 WHERE id = 3;                                       -- ERROR: would collide with msg id=2
ERROR:  duplicate key value violates unique constraint "ent_id_g"
DETAIL:  Key (id)=(2) already exists.
SELECT id, count(*) FROM ent GROUP BY id HAVING count(*) > 1;                     -- (none)
 id | count 
----+-------
(0 rows)

-- Section 4: dynamic add -- CREATE ... INHERITS a live spanning tree.
CREATE TABLE msg_2026_03 (CHECK (ts >= '2026-03-01' AND ts < '2026-04-01')) INHERITS (msg);
INSERT INTO msg_2026_03(id, ts, kind, body) VALUES (10, '2026-03-10', 'm', 'ok'); -- ok: new leaf registered
INSERT INTO msg_2026_03(id, ts, kind, body) VALUES (1, '2026-03-11', 'm', 'dup'); -- ERROR: enforced on the new leaf
ERROR:  duplicate key value violates unique constraint "ent_id_g"
DETAIL:  Key (id)=(1) already exists.
-- Section 5: dynamic add -- ALTER ... INHERIT a pre-populated table (backfill).
CREATE TABLE late (id int NOT NULL, ts date NOT NULL, kind text, note text);
INSERT INTO late VALUES (50, '2026-01-01', 'l', 'fifty'), (51, '2026-01-02', 'l', 'fiftyone');
ALTER TABLE late INHERIT ent;                                                    -- backfills 50,51
INSERT INTO msg_2026_01(id, ts, kind, body) VALUES (50, '2026-01-21', 'm', 'd'); -- ERROR: backfilled id=50 enforced
ERROR:  duplicate key value violates unique constraint "ent_id_g"
DETAIL:  Key (id)=(50) already exists.
-- ALTER INHERIT of a table that already conflicts is rejected at attach time
CREATE TABLE bad (id int NOT NULL, ts date NOT NULL, kind text, note text);
INSERT INTO bad VALUES (9, '2026-01-01', 'b', 'conflicts');
ALTER TABLE bad INHERIT ent;                                                     -- ERROR: id=9 already in tree
ERROR:  duplicate key value violates unique constraint "ent_id_g"
DETAIL:  Key (id)=(9) already exists.
DROP TABLE bad;
-- Section 6: dynamic remove -- NO INHERIT retires the child's entries.
ALTER TABLE late NO INHERIT ent;
INSERT INTO msg_2026_01(id, ts, kind, body) VALUES (50, '2026-01-22', 'm', 'now-ok');  -- ok: 50 was retired
ALTER TABLE late INHERIT ent;                                                    -- ERROR: 50 now back in the tree
ERROR:  duplicate key value violates unique constraint "ent_id_g"
DETAIL:  Key (id)=(50) already exists.
DROP TABLE late;
-- Section 7: DROP of an inheritance leaf cleans its partseq map (OID-reuse safe).
SELECT count(*) AS partseq_rows_before_drop FROM pg_index_partition;
 partseq_rows_before_drop 
--------------------------
                        7
(1 row)

DROP TABLE msg_2026_03;
SELECT count(*) AS partseq_rows_after_drop FROM pg_index_partition;              -- one fewer
 partseq_rows_after_drop 
-------------------------
                       6
(1 row)

-- Section 8: integrity oracle -- no cross-leaf duplicates survived any of the
-- build/insert/update/attach/detach/drop operations above.
SELECT id, count(*) FROM ent GROUP BY id HAVING count(*) > 1;                     -- (none)
 id | count 
----+-------
(0 rows)

-- Section 9: multi-level DECLARATIVE partitioning is spanned by the same path.
CREATE TABLE mld (id int NOT NULL, region text NOT NULL, ts date NOT NULL)
    PARTITION BY LIST (region);
CREATE TABLE mld_us PARTITION OF mld FOR VALUES IN ('us') PARTITION BY RANGE (ts);
CREATE TABLE mld_us_24 PARTITION OF mld_us FOR VALUES FROM ('2024-01-01') TO ('2025-01-01');
CREATE TABLE mld_us_25 PARTITION OF mld_us FOR VALUES FROM ('2025-01-01') TO ('2026-01-01');
INSERT INTO mld VALUES (1, 'us', '2024-06-01');
CREATE UNIQUE INDEX mld_id_g ON mld (id) GLOBAL;
INSERT INTO mld VALUES (1, 'us', '2025-06-01');  -- ERROR: dup across grandchild leaves
ERROR:  duplicate key value violates unique constraint "mld_id_g"
DETAIL:  Key (id)=(1) already exists.
INSERT INTO mld VALUES (2, 'us', '2025-06-01');  -- ok
SELECT id, count(*) FROM mld GROUP BY id HAVING count(*) > 1;                     -- (none)
 id | count 
----+-------
(0 rows)

-- Section 9b: a grandchild leaf added to the multi-level tree AFTER the spanning
-- index exists must register its partseq via the ancestor walk -- its direct
-- parent mld_us carries no spanning index of its own, so the partition
-- index-clone path (which only inspects the direct parent) misses it.  Before
-- the fix the new leaf got no partseq and failed closed ("no partseq for
-- partition") at the first INSERT.
CREATE TABLE mld_us_26 PARTITION OF mld_us
    FOR VALUES FROM ('2026-01-01') TO ('2027-01-01');
INSERT INTO mld VALUES (3, 'us', '2026-06-01');  -- ok: new grandchild leaf is registered + usable
INSERT INTO mld VALUES (1, 'us', '2026-07-01');  -- ERROR: dup id=1 enforced on the new grandchild
ERROR:  duplicate key value violates unique constraint "mld_id_g"
DETAIL:  Key (id)=(1) already exists.
SELECT id, count(*) FROM mld GROUP BY id HAVING count(*) > 1;                     -- (none)
 id | count 
----+-------
(0 rows)

-- DROP of the after-index grandchild cleans its partseq map (OID-reuse safe)
DROP TABLE mld_us_26;
INSERT INTO mld VALUES (1, 'us', '2025-06-15');  -- ERROR: still enforced via the build-first leaf
ERROR:  duplicate key value violates unique constraint "mld_id_g"
DETAIL:  Key (id)=(1) already exists.
SELECT id, count(*) FROM mld GROUP BY id HAVING count(*) > 1;                     -- (none)
 id | count 
----+-------
(0 rows)

-- Section 10: a leaf whose column order DIFFERS from the root (attached via
-- ALTER ... INHERIT).  The index records key attnums relative to the root, so
-- they must be remapped to the leaf by name -- on backfill AND on live
-- INSERT/UPDATE -- or it would read the wrong column and miss duplicates.
-- (ent currently holds ids {1,2,3,9}.)
CREATE TABLE reord (note text, ts date NOT NULL, id int NOT NULL, kind text);    -- id is attno 3, not 1
INSERT INTO reord(note, ts, id, kind) VALUES ('conflicts', '2026-01-15', 1, 'r');
ALTER TABLE reord INHERIT ent;                  -- ERROR: backfill reads id, rejects dup id=1
ERROR:  duplicate key value violates unique constraint "ent_id_g"
DETAIL:  Key (id)=(1) already exists.
DELETE FROM reord;
INSERT INTO reord(note, ts, id, kind) VALUES ('ok', '2026-01-16', 77, 'r');
ALTER TABLE reord INHERIT ent;                  -- clean (id=77)
INSERT INTO msg_2026_01(id, ts, kind, body) VALUES (77, '2026-01-21', 'm', 'd'); -- ERROR: backfilled id=77 enforced
ERROR:  duplicate key value violates unique constraint "ent_id_g"
DETAIL:  Key (id)=(77) already exists.
INSERT INTO reord(note, ts, id, kind) VALUES ('x', '2026-01-17', 2, 'r');        -- ERROR: live INSERT reads id, rejects
ERROR:  duplicate key value violates unique constraint "ent_id_g"
DETAIL:  Key (id)=(2) already exists.
UPDATE reord SET id = 9 WHERE id = 77;          -- ERROR: live UPDATE reads id, collides with id=9
ERROR:  duplicate key value violates unique constraint "ent_id_g"
DETAIL:  Key (id)=(9) already exists.
INSERT INTO reord(note, ts, id, kind) VALUES ('new', '2026-01-18', 88, 'r');     -- ok
SELECT id, count(*) FROM ent GROUP BY id HAVING count(*) > 1;                     -- (none)
 id | count 
----+-------
(0 rows)

DROP TABLE reord;
-- Section 11: multiple inheritance / diamond -- a leaf reachable via two paths
-- to the same spanning root is deduped to ONE partseq and enforced once.
CREATE TABLE dr (id int NOT NULL, ts date NOT NULL);
CREATE TABLE da () INHERITS (dr);
CREATE TABLE db () INHERITS (dr);
CREATE TABLE dchild () INHERITS (da, db);
NOTICE:  merging multiple inherited definitions of column "id"
NOTICE:  merging multiple inherited definitions of column "ts"
CREATE UNIQUE INDEX dr_id_g ON dr (id) GLOBAL;
INSERT INTO dchild(id, ts) VALUES (1, '2026-01-01');
INSERT INTO da(id, ts) VALUES (1, '2026-01-02');   -- ERROR: same root, enforced
ERROR:  duplicate key value violates unique constraint "dr_id_g"
DETAIL:  Key (id)=(1) already exists.
INSERT INTO dr(id, ts) VALUES (1, '2026-01-03');   -- ERROR: enforced at the root too
ERROR:  duplicate key value violates unique constraint "dr_id_g"
DETAIL:  Key (id)=(1) already exists.
INSERT INTO dchild(id, ts) VALUES (2, '2026-01-04');  -- ok
SELECT id, count(*) FROM dr GROUP BY id HAVING count(*) > 1;                      -- (none)
 id | count 
----+-------
(0 rows)

-- Section 11b: a diamond leaf's dead spanning entries must be retired through the
-- ancestor walk that reaches the spanning root via the leaf's non-first
-- inheritance parent (regression for a partition-only walk that missed such a
-- root and silently dropped its cleanup).  Under the default eager path, VACUUM
-- retires them in-line (progresql_vacuum_spanning_indexes), so the deferred drain
-- finds nothing left to retire.  Confirm enforcement + integrity across the cycle.
INSERT INTO dchild(id, ts) SELECT g, '2026-02-01' FROM generate_series(100, 120) g;
DELETE FROM dchild WHERE id BETWEEN 100 AND 110;
VACUUM dchild;
SELECT pg_drain_spanning_index('dr_id_g');               -- 0: eager VACUUM already retired them
 pg_drain_spanning_index 
-------------------------
                       0
(1 row)

INSERT INTO dchild(id, ts) VALUES (100, '2026-02-02');  -- ok: id=100 deleted + eager-retired
INSERT INTO dchild(id, ts) VALUES (115, '2026-02-03');  -- ERROR: id=115 still live, enforced
ERROR:  duplicate key value violates unique constraint "dr_id_g"
DETAIL:  Key (id)=(115) already exists.
SELECT id, count(*) FROM dr GROUP BY id HAVING count(*) > 1;                      -- (none)
 id | count 
----+-------
(0 rows)

DROP TABLE dr CASCADE;
NOTICE:  drop cascades to 3 other objects
DETAIL:  drop cascades to table da
drop cascades to table db
drop cascades to table dchild
-- Section 12: COPY into an inheritance leaf maintains the spanning index.  This
-- is the same write path logical-replication initial table sync uses, and a
-- spanning leaf usually has no local index, so COPY must drive spanning
-- maintenance itself or cross-leaf uniqueness is silently lost on bulk load.
-- (ent currently holds ids {1,2,3,9}.)
COPY msg_2026_02(id, ts, kind, body) FROM stdin;
ERROR:  duplicate key value violates unique constraint "ent_id_g"
DETAIL:  Key (id)=(1) already exists.
CONTEXT:  COPY msg_2026_02, line 2
COPY msg_2026_02(id, ts, kind, body) FROM stdin;
INSERT INTO msg_2026_01(id, ts, kind, body) VALUES (200,'2026-01-28','m','dup'); -- ERROR: COPY-loaded id enforced
ERROR:  duplicate key value violates unique constraint "ent_id_g"
DETAIL:  Key (id)=(200) already exists.
SELECT id, count(*) FROM ent GROUP BY id HAVING count(*) > 1;                     -- (none)
 id | count 
----+-------
(0 rows)

-- Section 13: foreign keys that RESOLVE ACROSS typed children.  A FK to the
-- inheritance root's spanning PK must (a) find the referenced row in whatever
-- child holds it, (b) enforce RESTRICT/CASCADE when a referenced row is
-- deleted/updated from a child (including a different typed child), and (c)
-- extend to children added dynamically after the FK already exists.
CREATE TABLE fke (id int NOT NULL, ts date NOT NULL, kind text);
CREATE TABLE fke_msg (body text) INHERITS (fke);
CREATE TABLE fke_msg_jan (CHECK (ts >= '2026-01-01' AND ts < '2026-02-01')) INHERITS (fke_msg);
CREATE TABLE fke_fct (claim text) INHERITS (fke);
CREATE TABLE fke_fct_jan (CHECK (ts >= '2026-01-01' AND ts < '2026-02-01')) INHERITS (fke_fct);
CREATE UNIQUE INDEX fke_id_g ON fke (id) GLOBAL;
INSERT INTO fke_msg_jan(id,ts,kind,body) VALUES (1,'2026-01-10','m','a'),(2,'2026-01-11','m','b');
INSERT INTO fke_fct_jan(id,ts,kind,claim) VALUES (3,'2026-01-12','f','c');
CREATE TABLE fk_restrict (rid int PRIMARY KEY, eid int REFERENCES fke(id));
CREATE TABLE fk_cascade  (rid int PRIMARY KEY, eid int REFERENCES fke(id) ON DELETE CASCADE);
-- (a) existence resolves into children: id=1 (msg child), id=3 (fct child, cross-type)
INSERT INTO fk_restrict VALUES (10, 1);
INSERT INTO fk_cascade  VALUES (20, 3);
INSERT INTO fk_restrict VALUES (11, 99);   -- ERROR: 99 is in no child
ERROR:  insert or update on table "fk_restrict" violates foreign key constraint "fk_restrict_eid_fkey"
DETAIL:  Key (eid)=(99) is not present in table "fke".
-- (b) RESTRICT blocks a child DELETE of a referenced row
DELETE FROM fke_msg_jan WHERE id = 1;      -- ERROR: still referenced from fk_restrict
ERROR:  update or delete on table "fke_msg_jan" violates foreign key constraint "fk_restrict_eid_fkey_2" on table "fk_restrict"
DETAIL:  Key (id)=(1) is still referenced from table "fk_restrict".
-- CASCADE fires on a cross-type child DELETE
DELETE FROM fke_fct_jan WHERE id = 3;      -- cascades to fk_cascade rid=20
SELECT count(*) AS cascade_left FROM fk_cascade WHERE rid = 20;   -- 0
 cascade_left 
--------------
            0
(1 row)

-- (c) a dynamically-added child acquires the FK action triggers too
CREATE TABLE fke_msg_feb (CHECK (ts >= '2026-02-01' AND ts < '2026-03-01')) INHERITS (fke_msg);
INSERT INTO fke_msg_feb(id,ts,kind,body) VALUES (5,'2026-02-10','m','e');
INSERT INTO fk_cascade VALUES (50, 5);
DELETE FROM fke_msg_feb WHERE id = 5;      -- cascades on the dynamic child
SELECT count(*) AS dyn_cascade_left FROM fk_cascade WHERE rid = 50;   -- 0
 dyn_cascade_left 
------------------
                0
(1 row)

DROP TABLE fke CASCADE;
NOTICE:  drop cascades to 7 other objects
DETAIL:  drop cascades to table fke_msg
drop cascades to table fke_msg_jan
drop cascades to table fke_msg_feb
drop cascades to table fke_fct
drop cascades to table fke_fct_jan
drop cascades to constraint fk_restrict_eid_fkey on table fk_restrict
drop cascades to constraint fk_cascade_eid_fkey on table fk_cascade
DROP TABLE fk_restrict;
DROP TABLE fk_cascade;
DROP TABLE ent CASCADE;
NOTICE:  drop cascades to 5 other objects
DETAIL:  drop cascades to table msg
drop cascades to table msg_2026_01
drop cascades to table msg_2026_02
drop cascades to table fct
drop cascades to table fct_2026_01
DROP TABLE mld;
